"id","SrcDatabase","Title","Author","Organ","Source","Keyword","Summary","Year","Volume","Period","URL"
"sh0","期刊","中国女性初育后的长期就业轨迹 基于序列分析的探索","杨一纯; 於嘉; 谢宇","北京大学光华管理学院社会研究中心;普林斯顿大学社会学系;","社会","女性劳动参与;;生育;;生命历程;;社会变迁;;序列分析","女性初次生育后就业状态的转变是劳动力市场性别不平等的重要机制。以往研究大多将就业视为静态单一性事件，缺乏基于生命历程的长期动态视角。本文使用2014年中国健康与养老追踪调查（CHARLS）的生命史数据，采用序列分析技术，刻画出中国出生于1940—1978年的非农职业女性在初育前后共计21年的六类典型就业轨迹，女性的就业时期涵盖了建国初期、市场转型初期和转型成熟期三个重要的劳动力市场转型节点。结合社会变迁，本文进一步探讨了女性就业轨迹的世代转变和影响女性就业因素的变迁。结果显示，随着世代变迁，中国女性就业轨迹的复杂性和多样性明显增加，人力资本、制度庇护与照料责任的保护作用则显著削弱。本研究有助于加深学界对市场改革和劳动力市场性别不平等的认知。","2023","43","05","https://link.cnki.net/doi/10.15992/j.cnki.31-1123/c.2023.05.009"
"sh1","期刊","礼乐文明的构成：“文质论”社会理论初探","吴飞","北京大学哲学系;","社会","礼乐文明;;文质论;;社会理论;;政治哲学","相对于古希腊的城邦文明和现代西方的社会文明，传统中国形成了一种礼乐文明，其基本构成方式是“文质论”。质即自然，文即文明，文明是通过将内在于质的纹理文饰出来，所以，文明在根本上来自自然，不能超越、改变和破坏自然。礼学中的尚文尚质，在根本上都是一种文。“文质论”何以构成礼乐文明？本文分为礼仪和礼制两个层次讨论：礼仪是仪式层面的礼，其内在原理是以礼文来节文人情；礼制是社会政治层面的各种制度，其构成原理与礼仪相同。在这个层面，亲亲即质，尊尊即文。人类的群体生活并非文明的建构，而有其自然基础，即亲亲。由亲亲生出尊尊，就是在自然生生共同体中发现内在的尊尊秩序，把它文饰出来，并建立更大范围的文明共同体。在这个意义上，国家并不是必要的恶、社会契约或暴力机构，而是对生生共同体的文明转化。由于“文质论”和西方社会理论一样，并不把国家政治当做最高的文明制度，我们视之为一种社会理论，但它也与希腊政治哲学有共同之处，即来自自然，归于自然。","2023","43","05","https://link.cnki.net/doi/10.15992/j.cnki.31-1123/c.2023.05.006"
"sh2","期刊","统一而治殊：论顾炎武的“混合体制论”","曹正汉","浙江大学公共管理学院;","社会","封建;;郡县;;一统与治理的矛盾;;混合体制","顾炎武在《郡县论》中提出一种著名的改革理论，即在郡县制的框架内引入封建制的自治原则，形成“寓封建之意于郡县之中”的混合体制。对于这种混合体制论的意义，当代学者通常把它视为中央与地方关系的理论，或者视为地方分权论或“地方自治论”，认为其目的是在中央集权与地方分权之间实现平衡。本文的观点是，顾炎武的混合体制论不只是中央与地方关系的理论，也不只是地方分权论，还是处理“一统”与“治理”之关系的理论，特别是处理“一统”与“治理”之矛盾的理论，其中的核心思想可以概括为“统一而治殊”。本文的目的是论证这种观点，并进一步探讨“统一而治殊”的内在含义和思想来源及其实现机制和制度条件。","2023","43","05","https://link.cnki.net/doi/10.15992/j.cnki.31-1123/c.2023.05.002"
"sh3","期刊","“五服”与“三代”：从中国婚姻法禁婚范围的变迁看“性别”与“姓别”","赵晓力","清华大学法学院;","社会","宗亲;;外亲;;血亲;;中表婚","从清末变法开始，中国婚姻法的禁婚范围经历了一个从“五服”到“三代”的转变。中国传统社会自周代以后奉行“同宗不婚”的周礼，对中表婚则听民自便，法所不禁。1930年《中华民国民法典·亲属编》按照男女平等原则，将中国传统亲属分类——宗亲和外亲——改为西方式的血亲和姻亲，五服之外的宗亲和三代以内的中表亲能否结婚便成为问题。本文通过考察1950年《中华人民共和国婚姻法》婚姻自由原则与民间“同宗不婚”之礼的矛盾和1980年《中华人民共和国婚姻法》优生政策与婚姻自由原则在中表婚问题上的冲突，指出这些矛盾冲突的根源在于中西亲属分类凿枘不入，中国亲属分类是建立在社会性的“男女姓别”基础上，而不是生物性的“男女性别”基础上，传统社会“同宗不婚”和“中表为婚”是由于亲属制度重内轻外而非重男轻女造成的。","2023","43","05","https://link.cnki.net/doi/10.15992/j.cnki.31-1123/c.2023.05.008"
"sh4","期刊","为伤害“定价”：医疗损害纠纷中的通约实践","张龙","南开大学周恩来政府管理学院社会学系;","社会","医疗纠纷;;医疗损害赔偿;;赔偿金;;通约","对医疗损害赔偿的既有研究通常将重心放在赔偿制度或赔偿后果上，但是对确定赔偿金的微观社会过程，尤其是医疗损害纠纷中不同性质的损失和数量化的处理后果之间存在的张力，学界缺乏足够关注。基于笔者在中国北方某市三甲医院纠纷处理科室的田野调查，本文试图呈现不同渠道下医疗损害赔偿的完整“定价”过程。本文认为，医疗损害纠纷中的关键争议离不开通约，即将不同的属性转化为同一数量尺度的社会过程。研究发现，医疗损害纠纷中的通约实践通常在价值（价值的整合）、认知（信息的简化）和技术（测量的精准）三个维度展开，并且因不同渠道的制度化程度和不同属性的可通约程度而呈现不一样的展开形式。","2023","43","05","https://link.cnki.net/doi/10.15992/j.cnki.31-1123/c.2023.05.003"
"sh5","期刊","后物质主义价值观与中国居民的政治参与 基于世代差异的分析视角","池上新; 石耀东; 黄继朝","深圳大学政府管理学院社会学系;深圳大学社会科学学院;","社会","后物质主义价值观;;政治参与;;世代差异","基于世界价值观调查（WVS2018）的中国数据，本文从世代差异的分析视角考察了后物质主义价值观对中国居民政治参与的影响。研究发现，第一，当前中国居民的后物质主义价值观得分并不高，但呈现明显的世代差异，成长于改革开放之后的世代显著更高，并随着世代后移呈现递增趋势；第二，政治参与的世代效应在不同维度上有所差异，成长于改革开放之后的世代在制度外政治参与、网络政治参与上呈现世代递增趋势，在基层选举参与上则相反；第三，后物质主义价值观对基层选举参与的影响不显著，但对制度外政治参与、网络政治参与有促进作用，并且，对制度外政治参与的影响随着世代后移呈现递增趋势。研究证实，社会发展所带来的公众价值观的变迁，可以作为解释当代中国居民制度外政治参与和网络政治参与的文化变量之一，同时指出在价值观、公民有序政治参与引导上需要更加关注年轻世代。","2023","43","05","https://link.cnki.net/doi/10.15992/j.cnki.31-1123/c.2023.05.005"
"sh6","期刊","“稳定”的心理建构：乡村中老年教师集体身份认同与流动趋向的历史叙事","李彩虹; 朱志勇","清华大学公共管理学院;北京师范大学教育学部;","社会","乡村教师流动;;中老年教师;;集体身份认同;;单位制;;稳定","本研究以内蒙古东部的一所原国营农场小学作为个案，深入探析了快速城镇化进程中民族地区乡村中老年教师的流动趋向、特点及其原因，结合历史变迁和地区发展的视角“理解”其在多重情境中的人生抉择。研究发现，在管理体制改革、单位制变迁、教育管理体制变革的历史进程中，国营农场的中老年教师基于体制性身份、合法性身份、专业性身份的交叉建构，历时性地衍生出包含生存保障性认同、情感认同与依恋、专业效能感与自我认同三元要素的集体身份认同。该身份认同是单位成员基于紧密的社会共同体，因集体利益、集体意识、集体情感联结汇合而成的价值倾向与情感归属。最终，三元集体认同合力推进了中老年教师群体以“稳定”为内核的心理建构，解析了少有人关注的乡村中老年教师留守现象。在城镇化持续推进的当下，本研究对于促进乡村教师队伍建设具有一定的启示作用。","2023","43","05","https://link.cnki.net/doi/10.15992/j.cnki.31-1123/c.2023.05.001"
"sh7","期刊","比较历史社会学视野下的“列宁式政党” 列宁《怎么办？》新释","应星","清华大学社会学系;","社会","列宁式政党;;比较历史社会学;;《怎么办?》;;组织的武器","本文基于比较历史社会学和组织社会学的视角，在将俄国社会民主工党与俄国革命民粹派、第二国际社会民主党以及中国共产党进行相关比较的意义上，对列宁建党理论的经典著作《怎么办？》作了新的诠释。本文先分析了“灌输”机制在欧洲、俄国和中国的异同，而后重点解析了《怎么办？》第四章中三个核心的组织问题：通过对比韦伯对职业政治家的分析，阐释了列宁对职业革命家组织的重要性的理解；通过与中共白区工作的比较，突出了列宁提出把精干的组织核心与差序的组织圈层结合起来的意义；通过与俄国革命民粹派及第二国际的比较，展示了列宁关于政党组织的密谋性和集中性思想的渊源及其流变。本文的上述分析为“组织的武器”这一经典的论题赋予了新的理解。文章最后指出了中国社会学在单位和组织研究上从技术性分析走向追根溯源的政治性分析的意义。","2023","43","05","https://link.cnki.net/doi/10.15992/j.cnki.31-1123/c.2023.05.007"
"sh8","期刊","探寻组织研究的中国视角 第二十届“组织社会学实证研究工作坊”综述","虞锦美","上海大学社会学院;","社会",NA,"<正>2023年8月26—27日，由上海大学社会学院、《社会》编辑部、上海大学基层治理创新研究中心主办，多所大学协办的第二十届“组织社会学实证研究工作坊”（以下简称“工作坊”）在上海大学举行。来自国内外34所高校和科研院所的160余位资深教授、青年学者、学生参加了工作坊的学术研讨。","2023","43","05","https://link.cnki.net/doi/10.15992/j.cnki.31-1123/c.2023.05.004"
"sh10","期刊","何为“自由”：太虚佛教改革的中国化意涵","惠忆晨","清华大学社会学系;","社会","太虚;;社会转型;;佛教中国化","本文以近代著名僧人太虚在20世纪20至40年代的佛教改革和社会思想论说为对象，分析太虚是如何从佛教教理出发，因应当时的各种社会思潮，提出社会改革方案，并论述佛教同社会思潮以及社会转型之间的相互建构关系。本文一方面管窥佛教文明面对现代社会的创造性适应与转化何以可能，另一方面呈现一种积极入世的中国佛教面貌，使太虚的理念同韦伯比较宗教社会学中有关大乘佛教的现世心态和生活动力的论述展开隔空对话。最后，本文尝试从“方便”与“究竟”的范畴入手挖掘太虚社会理论的价值，也为佛教中国化提供新的理解视角。","2023","43","04","https://link.cnki.net/doi/10.15992/j.cnki.31-1123/c.2023.04.002"
"sh11","期刊","一种肯定的权力理论的形成：基于福柯与康吉莱姆关系的考察","叶晨阳","日本庆应义塾大学;","社会","福柯;;康吉莱姆;;规范;;正常化;;权力","自20世纪70年代以后，福柯逐渐发展出一套有别于过往基于“压抑假说”之权力观的新权力理论。尽管这种权力理论具有强烈的福柯色彩，但是通过这一时期的关键词“规范”，我们仍能清楚把握到康吉莱姆对福柯的影响。实际上，康吉莱姆所厘定的作为内在的、肯定性的生命形式的“规范”概念及其使用方法，不仅为福柯提供了摆脱“压抑假说”，构建肯定的权力理论的可能性条件，而且在福柯对自身权力理论的不足进行克服时，与之产生了共鸣。","2023","43","04","https://link.cnki.net/doi/10.15992/j.cnki.31-1123/c.2023.04.007"
"sh12","期刊","1949—1956年中国社会组织体系的型构","陈佳俊; 毛丹","浙江财经大学法学院;浙江大学社会学系;","社会","社会组织体系;;国家型构;;社会配合;;居民自助","1949—1956年的中国社会组织体系既不是西方社会中的“第三部门”，也不是传统民间社团的集合，而是由党领导的人民群众团体、重新登记的社会团体、非登记的居民群众互助组织这三类广义的社会组织构成，是在国家型构社会组织、社会精英配合、社会成员在社会边缘事务上自行填空的力量所驱动形成的适配政权建设的特定类型。要研究当代社会组织改革发展问题，需要注意这个起点及其持续影响。","2023","43","04","https://link.cnki.net/doi/10.15992/j.cnki.31-1123/c.2023.04.005"
"sh13","期刊","统治风险与胥吏人事：官吏分途现象形成与持续的政治逻辑分析","王泉伟","中国海洋大学政治学系;","社会","胥吏;;官吏分途;;统治风险;;辟署制","本文试图论证，官吏分途从治理逻辑来看是一个非常糟糕的制度安排，其形成与持续主要是政治逻辑支配的结果。古代中国一直存在着朋党与官僚贵族化等官僚人事风险，导致统治者的人事权力受到侵蚀，危及统治基础。胥吏人事制度涉及各级政府如何安排僚属的问题，因而与上述官僚人事风险紧密关联。文章认为，官吏分途的形成是东汉以来官僚贵族化的结果，贵族与庶族的社会身份差异影响了正式官制的设置，造成官与吏在来源人群、等级地位与道德评价上的全面分途。官吏分途的持续则与后世统治者对官僚人事风险的防范有关。胥吏人事的合理化需要重新引入政治上风险巨大的辟署制，统治者宁愿忍受官吏分途导致的治理弊病也不愿变革。本文的研究拓展了“风险论”的视野，揭示了此前较少为人关注的官僚人事风险及其对中国古代官僚体制的深远影响。值得注意的是，类似的统治风险在当代依然部分存在，也受到中央越来越多的关注重视，并着手防范整治。","2023","43","04","https://link.cnki.net/doi/10.15992/j.cnki.31-1123/c.2023.04.004"
"sh14","期刊","个体化是生育的滞碍吗？ 从法国家庭政策的演变历程与底层逻辑讲起","吴真","上海大学社会学院;","社会","个体化;;生育;;法国;;家庭政策;;底层逻辑","个体化常被当作生育率衰微的重要原由，二者的反向关联借由全球诸多国家的人口演变轨迹暂时得到承认，却在法国家庭政策成功实现生育反弹的历程中被消解。这一历程围绕对待家庭个体化的态度分为前后两段：20世纪60年代末之前，以压制个体意识、重塑家庭秩序为核心理念，结果是婚姻家庭越发多变，生育水平不升反降；自70年代起，法律政策转向顺应个体诉求、尊重个人选择，同时又在经济社会资源的再分配上注重对弱势个体的帮扶和对强势个体的监督，由此带来了从90年代至今的生育水平的回升。后一段的经验投射出法国学界与政界对个体化两重意涵的充分认知：一方面，接纳且善用个体化展现的能动性，另一方面，防范且遏制个体化导致的不公正。由此，在家庭政策的建构中逐渐形成兼顾个体自由和社会公平的底层逻辑，并以此为准绳一以贯之地进行政策的修缮和执行，最终疏通个体化对生育率的阻滞。这段历史不单旨在呈现具体的措施，更在于追问如何恰切地借助政策介入来扭转个体化对生育的抑制，以此为徘徊在崎岖路径上的各国提供思路和启迪。","2023","43","04","https://link.cnki.net/doi/10.15992/j.cnki.31-1123/c.2023.04.003"
"sh15","期刊","“通国身”：“具身化”理论的本土想象","冯碧莹; 宣朝庆","南开大学社会学系;","社会","具身化;;通国身;;身心一体;;生物—社会","“具身化”是近年来身体研究的重要议题，它以超越身心二元论为立论前提，但在推理方向上却又难以消解二元论的痕迹，因而构成该理论的一种内在困境。本文借助汉儒“通国身”思想深入发掘本土“身心一体”观念中的身体理论资源，可以拓宽该理论的发展空间。其中，“通国身”蕴含着“治身”与“治国”之间相通的义理，具有以下两点重要参考价值：就突破理论困境而言，中国文化将“身”作为一个生命体验式的交感系统，能够进一步消解二元论中原本具有的身心界限以及心相对于身的优先性；就开拓本土研究而言，生物—社会融合的本土身体观构成了理解中国社会的基底，它能够从生物演化与社会存在的角度考察生物性的“人”与社会性的“人”，以此丰富“社会”的基本理解方式，是一种扩展社会学传统界限的重要资源，值得被重新发掘。","2023","43","04","https://link.cnki.net/doi/10.15992/j.cnki.31-1123/c.2023.04.001"
"sh16","期刊","艾希曼、平庸之恶与服从行为研究 犹太创伤与社会心理学的另类叙事","周晓虹","南京大学社会学院;","社会","犹太创伤;;艾希曼;;平庸之恶;;社会心理学;;从众与服从","在社会心理学的历史上，他人或群体对个体的影响会使其行为发生怎样的改变，一直是一个引人关注又成果丰硕的领域。纳粹德国在第二次世界大战中对犹太人的疯狂屠戮，以及执行者在屠戮过程中通过“恪尽职守”表现出的机械、冷酷与无情，在引发阿伦特有关“平庸之恶”讨论的同时，也在社会心理学领域酿就了以米尔格拉姆的“服从行为”研究为主导的实验。这一实验在学理上可以追溯到勒温、谢里夫和阿希在该领域中的一系列先行研究，而在现实中则源自犹太世界长期以来尤其是在第二次世界大战中遭受的肉体和心灵的双重创伤。正是犹太人长期以来遭受的苦难，使得从众和服从的话题成为犹太裔社会心理学家挥之不去的梦魇及绵长的另类叙事。","2023","43","04","https://link.cnki.net/doi/10.15992/j.cnki.31-1123/c.2023.04.008"
"sh17","期刊","舆论支配与三重社会图景：涂尔干对卢梭社会学说的再造","黄剑波; 梅汝阳","华东师范大学社会发展学院;北京大学社会学系;","社会","舆论;;社会;;涂尔干;;卢梭","舆论支配既是卢梭阐释社会状态的关键，也是涂尔干分析社会事实的重要参照物。借助舆论议题，涂尔干在改造自身解释系统的同时再造了卢梭的社会学说。卢梭认为，舆论是社会堕落的根源，需经由立法者的引导才能变成政治创制的基石。在早期的社会形态学路径中，涂尔干从比较法的视角考察了舆论、法律与社会类型的关系，在否定卢梭人性基点的同时强调了社会对人性的提升作用。为摆脱“决定论”色彩，涂尔干在与塔尔德的论战中为舆论机制纳入个体同意的条件，使社会成为符合个体本性的自然约束。在集体表象视角下，涂尔干彻底倒置了卢梭对自然和社会所作的等级序列，将社会从“压制本性”的人性枷锁修正为“提升本性”的文明基石。","2023","43","04","https://link.cnki.net/doi/10.15992/j.cnki.31-1123/c.2023.04.006"
"sh19","期刊","集体制与家户生产对农业集体化时期生产实践的再考察","颜燕华","清华大学社会学系;","社会","集体化;;生产队长;;家户经验;;安溪茶产业","本文通过安溪一个产茶村落的个案，对农业集体化时期的生产实践及其产业后果进行了再考察。集体化时期虽然在形式上取消了家族组织，但家族组织的逻辑在实际的生产组织即生产队中得到了一定程度的延续，尤其是生产队长居于“公家”与“小家”之间的平衡角色延续了传统家族权威的行动伦理。在生产队长“家长式”的生产决策及以家户为基础的产销安排下，集体生产突破了产销技艺在核心家族内传承的方式，转而扩散到村庄内绝大多数家庭，最终有利于分田到户后的家庭产业和地方茶叶经济的发展。","2023","43","03","https://link.cnki.net/doi/10.15992/j.cnki.31-1123/c.2023.03.006"
"sh20","期刊","权利与权力：福柯治理术论述中的法律问题","肖瑛","上海大学社会学院;","社会","福柯;;治理术;;权利;;法律;;权力;;主体性","权利与权力之关系是西方政治思想的核心议题之一，达成了法律或法律规定的国家主权与个人权利既是权力实践的合法性来源又是其目标和边界的“正统共识”。但福柯在法兰西学院的系列课程中以治理术为主题，从不同角度对知识与权力之关系做了系统分析，展现了权力与权利、治理与法律错综复杂的历史关系，颠覆了上述共识。他在梳理中世纪以来欧洲社会治理史的过程中，一方面论证了国家和个人的主权权利是在具体的权力机制中形成的；另一方面强调，从管治到纪律再到生命权力，治理术的构成和变迁是一个以不同方式对权利和法律进行殖民的过程，并且因知识的掩饰，这些殖民机制愈发隐蔽。在对现代欧美资本主义制度做出上述揭露后，福柯并不反对治理，只是反对过度治理，也不主张返回正统的个人权利和国家主权，而是强调建构“新的权利”。这一新权利就是“批判”，即在具体的历史脉络中揭示权力与知识的共谋，呈现理性是如何成为支配人的治理机制的。福柯的灵魂深处闪烁着积极的“怀旧”之光，公元前后斯多葛学派的“自我治理”与二战后德国的新自由主义治理术是其光源。","2023","43","03","https://link.cnki.net/doi/10.15992/j.cnki.31-1123/c.2023.03.002"
"sh21","期刊","西方民主中的修辞两面性以韦伯和阿伦特为例","沈垚","清华大学公共管理学院;","社会","民主;;修辞;;真理;;意见;;政治煽动","在讨论民主政治的修辞时，韦伯和阿伦特都对照西方古代政治思想来论证各自对现代问题的诊断。他们分别代表了两种面对修辞的典型立场，也就西方的民主困境给出了基于各自时代语境的答案。韦伯的贡献在于，他指出了政治修辞与现代社会整体危机之间的关系，即民主官僚制下的政治冷漠和大众参与缺失。在此基础上韦伯提出了两个具体的解决之道，即卡里斯玛领袖的引导以及代表型议会制。但韦伯将修辞作为一种手段的处理未能将其与合法性建立联系。阿伦特则认为现代资本主义社会遮蔽了自古希腊以来人作为一种言说和行动的存在。她补充了修辞的另一面，即共识的形成。阿伦特更看重修辞作为一种自下而上的政治组织形式，看重言说对具体主体的揭示及其与合法性权力之间的关系。韦伯和阿伦特面对修辞的立场有各自的时代语境与局限，但对这一主题都做出了突出的贡献。","2023","43","03","https://link.cnki.net/doi/10.15992/j.cnki.31-1123/c.2023.03.007"
"sh22","期刊","流动的责任边界：基层政府的业务与政治","潘桐","中国人民大学社会学理论与方法研究中心;","社会","基层政府责任边界;;理性官僚制;;政治统合制;;业务部门;;政治单位","本文以一起“非正常上访”的事件过程为研究案例，探讨了基层政府责任边界的变化以及相关行动策略的产生。基层政府具有“业务部门”和“政治单位”的双重角色面向，其行为逻辑也不同——前者适用理性官僚制，清晰的任务边界设计在实践过程中使得基层政府责任边界模糊，为其规避风险留有制度空间；后者适用于政治统合制，模糊的任务边界设计反而迫使基层政府重新清晰其责任边界，展现出担当的一面。基层政府受两种制度逻辑的影响，责任边界呈现出“流动性”的特征，其行为也从“风险规避”向“风险担当”转化。本文使用“流动的责任边界”作为分析框架，强调情境变化和基层政府的双重角色面向在其行为塑造过程中的作用，以此对话和发展已有的基层政府责任研究。","2023","43","03","https://link.cnki.net/doi/10.15992/j.cnki.31-1123/c.2023.03.008"
