"id","SrcDatabase","Title","Author","Organ","Source","Keyword","Summary","Year","Volume","Period","URL"
"sh500","期刊","“不完全合作”:NGO联合行动策略 以“5·12”汶川地震NGO联合救灾为例","朱健刚; 赖伟军","中山大学社会学与人类学学院;中山大学中国公益慈善研究院;","社会","NGO;;合作;;行动策略;;不完全合作","中国NGO的发展策略越来越引起广泛关注,本文以""5·12""汶川地震NGO联合救灾行动为例,着重探讨当前中国NGO联合行动的""不完全合作""问题。本文认为,不完全合作是NGO在面对内外部制度约束和组织限制条件下的主动策略性行动选择,具体策略机制表现为联合行动目标的自我约束、有限的组织参与和弹性的组织形式等三方面。NGO不完全合作策略的产生是由外部政治机会空间有限、组织关系网络的非正式性,以及组织合作意愿不完全等组织内外部因素的共同形塑而成。本文还指出,在当前整体限制性的制度环境下,正是这种不完全合作策略使得NGO联合救灾在面对各种挑战的情况下成为可能,但也因为合作的不完全性,使得联合行动难以持续。NGO进一步的持续合作还需要新的组织模式。","2014","34","04","https://link.cnki.net/doi/10.15992/j.cnki.31-1123/c.2014.04.004"
"sh501","期刊","当代中国第二代农民工的身份认同、情感与集体行动","卢晖临; 潘毅","北京大学社会学系;香港理工大学应用社会科学系;","社会","中国农民工;;无产阶级化;;工人阶级的形成;;愤怒;;阶级行动","本文基于一个工人的口述和笔者在深圳和东莞的田野调查资料,集中研究第二代农民工的自我认同、愤怒以及集体行动,并试图把第二代农民工的研究纳入马克思阶级形成的理论视野,将情感体验、身份认同等通常归属于认同政治的主题与生产方式、阶级结构等阶级分析的传统主题结合起来,以凸显认同政治研究在马克思阶级分析中的价值。农民工的身份认同问题源自生产关系,当在生产关系中的利益对立无法缓解和消除时,我们看到认同政治不仅不会遮掩生产关系中的矛盾和冲突,反而会因为在农民工那里所引发的主体分裂和负面情绪,直接成为激发集体行动的动员力量。","2014","34","04","https://link.cnki.net/doi/10.15992/j.cnki.31-1123/c.2014.04.005"
"sh502","期刊","农民工社会认同的决定因素研究:基于上海的实证分析","褚荣伟; 熊易寒; 邹怡","复旦大学管理学院市场营销系;复旦大学国际关系与公共事务学院政治学系;复旦大学历史地理研究中心;","社会","农民工;;社会认同;;涵化;;身份;;社会融合","本文首次从国际移民的涵化理论视角对农民工的社会认同方式及决定因素进行探讨,通过对上海市农民工抽样调查数据的实证分析发现,农民工作为国家内部城乡移民的重要组成部分,其社会认同存在以户籍为基础的制度性约束和以资源匮乏为特征的能动性限制。农民工社会认同主要受文化态度、社会交往、经济成功和社会环境四类变量的影响,农民工的个体人口统计特征也会影响城市认同的意愿。当地语言的熟练程度、与当地人交朋友的意愿(而非与外省市的农民工交朋友)、类似群体的收入地位水平、感知到的社会歧视程度和参与保险的程度都成为重要的决定因素。因此,公共政策的制定与执行应该要有助于农民工的心理层面的社会认同的转变,尤其是从""外地人""向""本地人""的认知转型。","2014","34","04","https://link.cnki.net/doi/10.15992/j.cnki.31-1123/c.2014.04.006"
"sh503","期刊","世界工厂的“中国特色” 新时期工人状况的社会学鸟瞰","郭于华; 黄斌欢","清华大学社会学系;","社会","世界工厂;;中国特色;;工人阶级形成;;公民社会","面对新时代的劳工问题,特别是""新生代农民工""问题,经典理论遭遇""中国特色""的诸多挑战。本文从社会结构性视角探讨权力、资本和劳工的关系与互动,讨论在中国特定的制度背景与转型过程中,工人阶级的形成与公民社会的生成有着怎样的关系。研究认为,对工人而言,公民的基本权利就体现为各项劳动权利的实现和保障、劳工的组织化权利的落实;公民权利是工人阶级形成的前提条件,劳工阶级的出路在于形成自主的社会力量。工人的公民化过程,劳工权利亦即公民权利的获得与保护是解决劳资矛盾和转型正义的根本途径。就劳工问题而言,以能动社会的建设为先导,同时推进公民社会的建设,也许更为可行。","2014","34","04","https://link.cnki.net/doi/10.15992/j.cnki.31-1123/c.2014.04.007"
"sh504","期刊","社会资本与不平等的再生产 以农民工与城市职工的收入差距为例","程诚; 边燕杰","西安交通大学人文社会科学学院社会学系;西安交通大学实证社会科学研究所;","社会","社会资本;;收入不平等;;农民工;;职业分割;;人力资本","本文以农民工与城市职工收入差距研究为切入点,探讨社会资本对收入不平等的影响路径及其程度。通过分析中国8城市的调查数据,运用收入分解方法,考察社会资本影响农民工与城市职工收入差异的两条路径,即进入职业的机会差异和职业内的收入差异。研究结果表明,户籍制度和交往同质性原则导致农民工(相比城市职工)在社会资本存量方面更加欠缺,难以进入收入高的职业,且职业内的讨价还价能力也很有限。两种路径差异的综合,是导致农民工收入较低的重要社会原因,因此,社会资本是维持和固化社会不平等的微观机制。","2014","34","04","https://link.cnki.net/doi/10.15992/j.cnki.31-1123/c.2014.04.008"
"sh505","期刊","有限机会的公平分配 中国农民子女市民化的水平与模式","李丁","中国人民大学社会与人口学院;中国人民大学中国调查与数据中心;中国人民大学国家发展与战略研究院;","社会","农民子女;;市民化;;职业非农化;;身份市民化","本文将农民、农民工以及已经获得非农户籍的""新市民""的""农民子女""作为分析对象,以农民子女跨越城乡二元系统的市民化进程来透视中国社会系统的开放性与社会分层流动机制。基于CGSS调查数据等资料的分析表明,改革开放以来,中国农民的职业非农化水平快速提高,但身份市民化机会长期保持不变,两者之间的断裂日益扩大。这种断裂不仅表现在水平上,也表现在分配机制上。职业非农化的途径日益多元化,教育的作用相对弱化,家庭背景有着相对重要的作用。而户籍非农化(身份市民化)因升学之外的传统途径不断收缩,教育成为影响户籍非农化的主要因素,从而保持了有限的户籍非农化机会在农民子女间分配的公平性。","2014","34","04","https://link.cnki.net/doi/10.15992/j.cnki.31-1123/c.2014.04.009"
"sh506","期刊","告别i奴:富士康、数字资本主义与网络劳工抵抗","邱林川","香港中文大学新闻与传播学院;","社会","i奴;;富士康;;数字资本主义;;网络劳工抵抗","什么是数字资本主义条件下的世界工厂?它与过去的资本主义世界体系有何区别,又有何关联?在互联网和智能手机的时代,劳工真能形成自己的网络,抵御资本吗?本文以史鉴今,首先回顾17世纪""大西洋三角贸易""的奴隶制世界体系,再讨论当代富士康劳工问题、""21世纪奴隶制""及其内在的新三角贸易结构。四百年沧海桑田,不料在变劳工为奴隶这个问题上,无论是实证材料的细节,还是世界资本主义体系的宏观层面,依然存在种种勾连。文章在此基础上勾勒出网络化抵抗与新三角团结关系,并强调:劳工研究需要重新认识过去,让思想在全球历史的长河中重新扎根。在关注生产过程之外,还须重视消费,特别是虚拟空间里的生产性消费行为。","2014","34","04","https://link.cnki.net/doi/10.15992/j.cnki.31-1123/c.2014.04.010"
"sh507","期刊","房地产与阶层定型化社会 读《房地产阶级社会》","芦恒","吉林大学哲学社会学院社会学系;","社会",NA,"<正>1997年亚洲金融危机以来,韩国逐渐从国家主导的""压缩式现代化""模式,转变为市场独大的""美国式新自由主义""发展模式。高房价社会的产生正是市场力量全面渗透社会的产物,民众和国家经济为此付出了高昂的生活成本、经济成本,乃至社会成本。更为严重的是,房地产投机使得少数富裕阶层垄断大部分政治、经济和文化资源,加深了社会的两极分化。为此,韩国知识分子在近几年掀起了反思房地产的热潮,认为房地产是综合诊断韩国政治、经济和社会问题的""内视镜""。其中,最具代表性的是社会批评家孙洛龟所著的《房地产阶级社会》,他首","2014","34","04","https://link.cnki.net/doi/10.15992/j.cnki.31-1123/c.2014.04.011"
"sh508","期刊","侠气与民情 19世纪中叶地方军事化演变中的社会转型","侯俊丹","北京大学社会学系;","社会","侠气;;民情;;地方军事化;;失范型暴力;;夷平化","太平天国运动对晚清帝国的冲击不仅体现在财政税收、人口、土地关系等社会结构要素上,更重要的是人心与世风之变以及由此形成的新的社会民情基础。这一世风丕变特别体现在:地方为应对太平军冲击而进行的军事化运动中伴生的失范型暴力,是以""任侠之气""的精神伦理作为军事动员的内在组织原则而导致的后果。""侠气""这一精神伦理以""力""的无限扩张为法则,与传统帝国政治结构中的宗法、乡礼、师道以及凝结在地权上的依附关系形成巨大张力,由此造成军事化组织与国家政治的背离。""力""的无限扩张法则打碎了帝国政治所依赖的身份与等级结构,导致了夷平化的社会形态出现,从而对传统政治治理构成挑战,并最终召唤了用现代革命的方式推进政治和社会变迁的时代的到来。","2014","34","03","https://link.cnki.net/doi/10.15992/j.cnki.31-1123/c.2014.03.001"
"sh509","期刊","邸报与中晚明的公开议政","任文利","北京青年政治学院北京东方道德研究所;","社会","邸报;;公论;;公是非;;留中","作为处理公共事务的政治治理,政治的生命与活力在于公开,公开方可赋予政治治理以理性精神。以儒家传统话语而言,则为决之""公论"",""公是非于天下""。然而这一点的实现,则需要相应的媒介作为载体。本文所探讨的邸报,就是""公论""与""公是非""的介质。中晚明的邸报,其承载内容之全面,覆盖范围之广,传播速度之快,不仅使明代政治呈现高度的公开透明性,而且有效促进了儒家士大夫的议政热情。晚明的""清议""风行,也与此有很大的关联。以明代历史沿革而言,邸报之从无到有,至万历臻于极致,进而延续至明亡,体现了儒家士大夫为实现自身的政治理想于政治制度建置上的努力。","2014","34","03","https://link.cnki.net/doi/10.15992/j.cnki.31-1123/c.2014.03.002"
"sh510","期刊","重新思考公民与公共生活 基于儒家立场和中国历史经验","姚中秋","北京航空航天大学人文与社会科学高等研究院;","社会","公民;;公共生活;;儒学;;君子","本文基于中国的历史经验和儒家理念,重新思考公共生活与公民概念。在西方,无论在历史中还是在理论中,公共生活的基本载体都是城邦,这是一个点状的政治共同体。不过,至少从尧舜开始,自觉的中国就呈现为超大规模的文明与政治共同体,由此也决定了中国的公共生活形态和公民身份与西方不同:中国存在着多中心、多层级的公共生活单元;所有人在不同层级上参与公共生活,多少都具有公民性;作为积极公民的古典君子或者儒家士君子的公民身份是多层次和可扩展的,是真正的国家公民。这一中国经验提醒我们,应该超越基于西方经验形成的关于公共生活和公民的地方性概念和理论,发展更为普遍的共同体、公共生活和公民理论。","2014","34","03","https://link.cnki.net/doi/10.15992/j.cnki.31-1123/c.2014.03.003"
"sh511","期刊","公共话语的演变与危机","任锋","中国人民大学国际关系学院政治学系;","社会","公共话语;;公共理念;;公共性;;公法;;公论","对于公共性的讨论亟须立足于文明传统内在机理的观察和反思。中国传统中的公共意识和精神以天人秩序和三代典范为基线,并于近世见证了公共话语的兴起与公共理念的成型。共治宪制(公法、公论)与社会治理形成了这一过程的实践语境,以理学为代表的近世儒学扮演了关键角色。近世公共话语在现代经历了复杂的转型,同时也显露出内在危机,这也成为反思与推进公共性讨论的重要缘由。","2014","34","03","https://link.cnki.net/doi/10.15992/j.cnki.31-1123/c.2014.03.004"
"sh512","期刊","中国宗教研究的“政治经济学”尝试 评《中国的宗教》","张文杰","北京大学社会学系;","社会",NA,"<正>杨凤岗教授是目前华人宗教社会学家中较为西方学界所熟知的一位。他任教于美国普渡大学社会学系,并担任该校""中国宗教与社会研究中心""主任。2011年底,杨凤岗以先期出版的几篇论文(Yang,2004,2006,2010a,2010b)为基础,在修改和扩展之后,出版了其研究当代中国宗教的专著——《中国的宗教》(Religion in China:Survival and Revival under Communist Rule)(Yang,2011)。这本书在概念图式上借","2014","34","03","https://link.cnki.net/doi/10.15992/j.cnki.31-1123/c.2014.03.005"
"sh513","期刊","越过“界限”:现代公共生活中的大众 读奥尔特加·加塞特的《大众的反叛》","邢朝国","北京科技大学社会学系;","社会",NA,"<正>《大众的反叛》1是现代大众社会理论的经典之作。2在该书中,加塞特提出了""大众的反叛""(the rebellion of the masses)这一命题,即大众越过自己的界限,开始占据最高的社会权力,而这些权力原本属于社会精英。要说明这一命题,我们需要弄清楚这样几个基本问题:何为界限?大众的反叛与界限之间有何关联?大众又为何要反叛?对于这些问题,","2014","34","03","https://link.cnki.net/doi/10.15992/j.cnki.31-1123/c.2014.03.006"
"sh514","期刊","微博空间组织间网络结构及其形成机制 以环保NGO为例","黄荣贵; 桂勇; 孙小逸","复旦大学社会学系;香港城市大学公共政策学系;","社会","组织间网络;;环保NGO;;微博;;同质性原则;;合适性原则","本文使用社会网络分析技术探索微博空间中环保非政府组织间关注/认同关系网的结构,并结合组织间网络、社会运动联盟、互联网研究文献以及我国非政府组织管理制度来探究网络结构的形成机制。研究发现,非政府组织间存在紧密的虚拟联系。统计分析显示,组织间虚拟关系受网络自组织机制、组织资源、合适性原则(注册状态)、同质性原则(离线关系、地理位置、关注领域)和微博使用活跃程度等因素的影响。其中,资源发挥""信号""功能,是组织可信赖性的基础,资源未知者不容易被关注/认同。对于资源已知者而言,资源匮乏者更积极利用微博平台。未注册组织主动与其他组织建立关系,注册组织则避免与未注册组织建立关系。具有线下合作关系或处于同一省份的组织之间更可能建立关注和认同关系,但活动领域仅对认同关系具有影响。微博使用活跃程度也对组织间关系具有正向的影响。","2014","34","03","https://link.cnki.net/doi/10.15992/j.cnki.31-1123/c.2014.03.007"
"sh515","期刊","上海多性伴性行为现状及其影响因素研究","庄渝霞","上海社会科学院城市与人口发展研究所;","社会","性行为;;性安全;;多性伴","本文利用上海市的调查数据,首先考察了上海市多性伴性行为的性别差异,接着从阶层归属、家庭亲属生活、性爱生活和性别规范四个层面对多性伴性行为的影响因素进行理论建构。研究结果表明:在多性伴性行为中,""生理需要论""并不起作用;""资本运作""和""环境影响""取代""阶层归属""发挥显性作用;""婚内感情论""具有一定合理性但也存在时效性,""头两年之痒""和""七年之痒""并存;""越轨""性行为具有连贯性;性别规范通过中间变量(两性在社会、家庭和性领域的角色扮演)间接影响两性的性活动方式。因此,我们需要以社会性别视角鉴别女性""性革命""成功与否,思考女性在性地位上是真正解放还是重新被奴役。","2014","34","03","https://link.cnki.net/doi/10.15992/j.cnki.31-1123/c.2014.03.008"
"sh516","期刊","2013年余天休社会学优秀博士论文奖颁奖仪式在上海大学举行","于社博",NA,"社会",NA,"<正>2013年余天休社会学优秀博士论文奖颁奖仪式于2013年12月21日上午在上海大学隆重举行。2013年余天休社会学优秀博士论文奖获得者刘博(上海大学社会学系2012届毕业博士生、现为上海市委党校社会学部教师)、陈鹏(清华大学社会学系2012届毕业博士生、现为北京师范大学社会管理研究院教师),中国社会学会副会长、上海大学副校长李友梅教授,中国社会学会副会长、余天休社会学","2014","34","03","https://link.cnki.net/doi/10.15992/j.cnki.31-1123/c.2014.03.009"
"sh518","期刊","父母与自然 “知母不知父”的西方谱系(下)","吴飞","北京大学哲学系;","社会","母权论;;自然;;形式;;质料","本文紧接《母权神话》,是对母权社会的文化根源的分析。文章认为,在现代思想家中,霍布斯已经谈到过母权论者的主要观点,巴霍芬的《母权论》是对霍布斯的继承,其中给出的诠释,即母亲代表自然,父亲代表文化,是母权论人类学家的基本假定,而这种假定又来自亚里士多德关于父亲提供形式、母亲提供质料的古典观念。现代女性主义者试图以种种方式化解亚里士多德以来的性别问题,却使自己陷入了新的困境。","2014","34","03","https://link.cnki.net/doi/10.15992/j.cnki.31-1123/c.2014.03.010"
"sh519","期刊","体制分割与中国城镇居民的住房差异","方长春","南京大学社会学院社会学系;","社会","体制分割;;住房不平等;;住房市场化改革","在混合经济形态下,""市场""与""再分配""权力之间的良性制衡的关系尚未形成,相反却在一定程度上对社会不平等的形成表现出层叠效应。对住房不平等的经验分析表明,当前(住房市场化时期)的住房不平等状况很大一部分是由房改前的住房分配过程和住房私有化改革过程导致的,社会成员越是接近体制的核心部门,其住房优势就越突出。这一经验研究发现表明,制度变革的渐进性和路径依赖使得根植于体制分割的社会不平等在尚未充分消退的同时,改革之前导致社会差异形成的体制分割因素依然在一定程度上活跃于当前的社会不平等中,且有可能会随着市场化的推进叠加于源自于市场的社会不平等,甚至经由市场的作用进一步延续并放大。","2014","34","03","https://link.cnki.net/doi/10.15992/j.cnki.31-1123/c.2014.03.011"
"sh520","期刊","性别观念、现代化与女性的家务劳动时间","於嘉","香港科技大学社会科学部;","社会","家务劳动;;影响因素;;性别观念;;现代化","通过分析2010年中国家庭追踪调查数据,本文考察了中国城乡已婚女性家务劳动时间的影响因素。研究发现,已婚女性的工作时间与绝对收入的增加可以显著地帮助她们减少家务劳动时间。此外,本文检验了女性的相对收入对家务劳动时间的影响在城乡与地区间的差异。结果表明,城镇地区女性相对收入的增加可以帮助她们持续地减少家务劳动,而农村地区的女性受到传统性别观念的影响,无法持续地利用相对收入的增加来减少其家务劳动。通过将调查数据与市级统计数据匹配,本文进一步发现,在农村地区,现代化水平的不同会造成女性相对收入对家务劳动影响的地区差异。在现代化程度较高的地区,女性相对收入对家务劳动的议价能力较强,而在现代化程度较低的地区,这种议价能力更容易受到限制。","2014","34","02","https://link.cnki.net/doi/10.15992/j.cnki.31-1123/c.2014.02.007"
"sh521","期刊","“反精神医学”的谱系:精神卫生公共性的历史及其启示","杨锃","上海大学社会学院社会工作学系;","社会","反精神医学;;去机构化;;精神卫生/精神医疗;;公共性;;巴扎利阿","基于对上世纪后半叶以来""反精神医学""历史的考察,本文试图提出反精神医学运动如何影响精神卫生公共性建设的问题。文章结合当时欧美社会民权运动的背景,从""反精神医学""诸种思潮中梳理出其指涉公共性的各个面向,探讨其历史经验与启示。在传统精神医学陷入危机之时,反精神医学的精神卫生观转向以精神病患为主体,其中对""全控机构""的批判和标签论颠覆了传统精神医学的神话,成为""去机构化""意识形态的合力;同时,草根组织的援助改变了被收容者的社会处置方式;巴扎利阿的精神医疗改革则进一步解放了被收容者,其提出的废除精神病院、通过立法保障患者权益的案例,进一步彰显出精神卫生的公共性何以可能的历史经验。在此基础上,文章对精神卫生的公共性所指涉的目标和价值取向、精神卫生改革中的公众参与以及争取合法保障精神卫生相关权益的经验进行了讨论。","2014","34","02","https://link.cnki.net/doi/10.15992/j.cnki.31-1123/c.2014.02.001"
"sh522","期刊","作为标签的越轨和艺术 从标签理论解读贝克尔的《局外人》与《艺术界》之关联","卢文超","清华大学人文学院哲学系;","社会",NA,"<正>一、越轨和艺术中的两种名实不符寻常人都会认为,苹果就是苹果,梨就是梨。假如有人说苹果是梨,或者说梨是苹果,那么,我们肯定能立即发现此人的错误。对于两者而言,名和实若有不符,我们可以轻易地辨明。但是,天底下并非所有的事物都可以如此轻易地辨明,美国社会学家贝克尔(Howard S.Becker)1研究的越轨和艺术就都属于这种不易辨明的事物。越轨和艺术相距十万八千里,怎么会把两者放在一起讨论?有意思的是,作为一个会弹钢琴、会摄影的社会学家,贝克尔既是研究越轨","2014","34","02","https://link.cnki.net/doi/10.15992/j.cnki.31-1123/c.2014.02.002"
"sh523","期刊","中国家庭追踪调查:理念与实践","谢宇; 胡婧炜; 张春泥","美国密歇根大学社会学系;北京大学社会研究中心;北京大学社会学系;","社会","中国家庭追踪调查;;社会调查;;CFPS","为了让研究者对中国家庭追踪调查(CFPS)有更多了解,本文从四个方面介绍其背景和特色。在设计理念上,CFPS以个人和家庭为研究主体,以多层次问卷和跟踪性调查为研究视角,充分考虑了社会现象的异质性、复杂性和时间性;在调查实施上,CFPS采用城乡一体的多阶段、内隐分层和与人口规模成比例的抽样方法保证样本的代表性,借助先进的调查技术提高访问质量,设计了兼顾研究需要和可操作性的追访原则;在问卷内容上,CFPS不仅涵盖内容广,而且在整合城乡问卷,收集家庭关系、人口流动、事件史、认知能力和少儿发展等相关数据上也均有长处;在数据上,本文以经济不平等、婚姻变迁、认知能力三个方面的数据研究为例,展示了CFPS的追踪设计和特色内容为社会科学研究带来的潜力。","2014","34","02","https://link.cnki.net/doi/10.15992/j.cnki.31-1123/c.2014.02.003"
"sh524","期刊","母权神话“知母不知父”的西方谱系(上)","吴飞","北京大学哲学系;","社会","母权论;;父权制;;原始婚姻","本文是《""知母不知父""的西方谱系》的上半部分,勾勒了19世纪后半期西方人类学界几位主要的母权论者和母系论者的思想。文章从梅因和库朗热对父权论的讨论开始,考察了麦克伦南、摩尔根和恩格斯对母权社会的讨论,指出,人类学界的母权论是针对古典学界的父权论发出的,并且都将母权时代当作更接近自然但也更原始的阶段,把父权社会当作更文明但也更不平等的历史阶段。","2014","34","02","https://link.cnki.net/doi/10.15992/j.cnki.31-1123/c.2014.02.004"
