"id","SrcDatabase","Title","Author","Organ","Source","Keyword","Summary","Year","Volume","Period","URL"
"sh251","期刊","社会学民族志的力量:重返早期社会研究的田野工作","田耕","北京大学社会学系;","社会","社会学民族志;;田野工作;;情感结构;;直接观察;;进步主义道德","自20世纪70年代以来,社会学民族志在田野工作和叙事复兴中与传统人文学汇聚,显著扩展了自己的学科边界。但是,这种扩展并没有解决社会学民族志在深度的经验发生和强烈的理论诉求之间遭遇的紧张。对于这种紧张,本文主张再访早期社会研究的田野,即19世纪末期到一战之前的若干典型研究,从中反思早期社会学田野工作是如何在""直接经验""的倾向中完成类型化,以及如何在这个经验感获得的同时改变对社会世界的道德想象。早期社会学的田野工作的力量之一不在于以规范的诉求压制经验感,而是以独特的情感结构连接经验的观察和道德理想的重生。由此,我们不仅需要反思诸如社会调查到社区研究这样的简单思路,更要重新理解理论史上所谓的""进步主义式""的道德本身。这一工作对重新认识早期社会研究和今天的社会学民族志都具有意义上的准备。","2019","39","01","https://link.cnki.net/doi/10.15992/j.cnki.31-1123/c.2019.01.003"
"sh252","期刊","从实证视角理解个案研究:三阶段考察渠文的方法创新","耿曙","浙江大学社会学系;","社会","研究方法;;个案研究;;实证视角;;个案选择;;理论建构","本文尝试对话渠敬东""迈向社会全体的个案研究""一文:一方面通过实证视角,就渠文进行爬梳与理解,盼激发更多跨界对话;另一方面针对方法应用,自该文提炼策略与建议,盼有助催生具体的研究策略。基于上述目的,本文将""从个案到全体""的历程划分为三个阶段:选择个案、研究个案、推论个案,藉以条理渠文丰富多彩的方法论述。讨论过程中就渠文提示的个案研究途径与传统实证和诠释路径并列对照,帮助说明渠文创新所在。在总的方向上,本文与渠文一致,一方面力图论证个案研究的价值,尝试勾勒出规范、系统的个案方法;另一方面尝试通过个案研究对话,使实证阵营能够理解、欣赏诠释阵营的研究思路与丰厚内涵。","2019","39","01","https://link.cnki.net/doi/10.15992/j.cnki.31-1123/c.2019.01.005"
"sh253","期刊","从三重功能到二元联盟杜梅齐尔印欧文明研究中的政治发生学思考","张原","西南民族大学西南民族研究院;","社会","杜梅齐尔;;三重功能论;;二元联盟;;等级团结;;政治发生学","基于社会学化的比较神话学研究,杜梅齐尔提出了由社会三重功能来形构理想的完整社会乃印欧文明所共有的意识形态的看法,这是从二元联盟的等级性团结中产生的一种政治观。通过承继莫斯与葛兰言的理论关怀,杜梅齐尔考察了印欧文明的等级构成与君权运作的社会学原理,并将联盟这一概念运用到国家内部的组织结构与运作逻辑的考察分析中。杜梅齐尔的政治发生学研究不仅改变了古典学以印欧世界的城邦制度与神圣王权为理论基点之人文探讨的视野,也拓展了人类学以土著社会的联盟组织和头人制度为问题核心的经验考察范围,为现代社会科学搭建起了一条贯通部落组织、古典国家与现代政治的比较研究路径。对于当代人文社会科学的中国研究而言,这种穿透性的考察极富启发性。","2019","39","01","https://link.cnki.net/doi/10.15992/j.cnki.31-1123/c.2019.01.006"
"sh254","期刊","寻求对“社会”的理解圣西门的社会生理学","倪玉珍","首都师范大学历史学;","社会","自然权利;;社会;;有机体;;统一性","法国大革命遭遇的挫折促成了19世纪初法国思想界对自然权利学说的反思。这一反思的重要成果是社会范畴受到关注和社会学说的兴盛。圣西门接续了孔多塞和观念学派创立""社会科学""的努力,探索""社会生理学""。他摒弃了启蒙时代盛行的抽象个体观,揭示了人的社会属性。他把社会视为有机体,认为社会的各个部分应相互协作,构成和谐的统一体。他还强调了欧洲社会历史演进的动力机制。在此基础上,圣西门提出了""组织""社会的初步设想。圣西门的社会学说融合了社会科学和社会主义的萌芽,促进了法国从革命向社会重建的重要转变。它给后世留下了双重的精神遗产:既唤起人们同情社会苦难的博爱情感,又提醒人们要科学地观察和研究社会事实,尤其在行动时要保持清明的理性。","2019","39","01","https://link.cnki.net/doi/10.15992/j.cnki.31-1123/c.2019.01.007"
"sh255","期刊","价值理想的认识与实践:马克斯·韦伯的伦理教育","王楠","中国政法大学社会学院;","社会","价值理想;;伦理人格;;自我清明;;责任伦理","在我们这个似乎已实现了""价值自由""的时代,马克斯·韦伯很少被人视为一位伦理教育者。本文尝试从韦伯身处的时代和社会背景出发,以其关于学术与政治之伦理意义的论述为重点,结合其书信和传记,来揭示韦伯思想中之伦理教育的面向。面对威廉二世时代的精神危机,韦伯力主社会科学虽具有抽象的观念性,但能够向人们揭示文明与历史中的超越性价值,并通过对其客观化实践的描述,令人们看到这些价值理想如何落实于现实,并产生复杂的变化与后果;由此,学术能够令人明确自身的价值立场及其实践后果,从而培养人的自我清明和求真务实的品质,在日常的工作与生活中朴实地践行自己的理想。另一方面,韦伯还告诫我们,要警惕主观理想潜藏的暴力性,认清实践的复杂性和悖谬性,将信念与清醒的现实责任感结合起来。","2018","38","06","https://link.cnki.net/doi/10.15992/j.cnki.31-1123/c.2018.06.004"
"sh256","期刊","“转型与发展:中国社会建设四十年”笔谈","邴正; 蔡禾; 洪大用; 雷洪; 李培林; 李强; 王思斌; 张文宏; 周晓虹","吉林大学哲学社会学院;中山大学城市社会研究中心;中国人民大学社会学理论与方法研究中心;华中科技大学社会学院;中国社会科学院社会学研究所;清华大学社会学系;北京大学社会学系;上海大学社会学院;南京大学社会学院;","社会","。“社区治理”的提出一方面意味着社区建设需要通过政府和多元行动主体之间的合作来实现,另一方面意味着要把社会利益诉求;;社会矛盾化解;;社会秩序维护;;公共安全建立等维护社会稳定的重心向社区下沉。如果比较一下党的十八大报告中关于“社会建设”和十九大","<正>主持人按语:今年是我国改革开放四十周年。在过去的四十年中,我国不仅在经济体制改革和经济建设领域取得了举世瞩目的成就,在社会建设领域的变革也全面推展,社会转型持续深入,社会体制改革不断深化,社会治理理念和实践创新层出不穷。改革开放也为社会学在中国的恢复和重建带来了契机。在过去的四十","2018","38","06","https://link.cnki.net/doi/10.15992/j.cnki.31-1123/c.2018.06.001"
"sh257","期刊","中国近代“公益”的观念生成:概念谱系与结构过程","武洹宇","中山大学社会学与人类学学院;","社会","公益;;概念谱系;;语义结构;;近代转型","与过去普遍认为中国""公益""概念舶自近代日本的观点不同,本文发现中国本土的""公益""语汇至少在清代中期已经出现,并具有经济收益、国家利益与地方公事三种用法。其中,表示""国家利益""的语义很可能随着《万国公法》的东渡而重塑了日本近代的""公益""概念,并于19世纪末伴随宣传维新思想的著述出版而传入中国,成为变革话语的建构工具。""公益""概念遂于清季十年得以普及并发生语义重构。综观其重构以后的语义格局,系列新生语义的现代特质一方面在于其所表征的""国家利益""被赋予了支持政体转型的群学理论与变革实践,另一方面亦承载了这一转型过程中国家与地方之间错综复杂的动态关系以及两者对""公""合法性资源的争夺,两个方面共同反映出中国""公益""的开端与国家制度近代转型之间的同构关系。这一同构在何种程度上可能形塑了中国公民性在特定文化脉络中的历史养成,或能为今天探讨公益慈善与公共精神提供一种关注本土内生属性的问题意识。","2018","38","06","https://link.cnki.net/doi/10.15992/j.cnki.31-1123/c.2018.06.005"
"sh259","期刊","个体的自我保存与社会学的现代道德人格属性:《自杀论》中的双重结构","孙飞宇","北京大学社会学系;","社会","社会学;;自杀;;自我保存;;现代道德人格","根据涂尔干关于自杀的定义,自杀必然意味着有意识的选择死亡。死亡只有一种对立面,即不死,二者之间没有中间项。所以,当涂尔干在《自杀论》中讨论自杀的时候,同时必然是在隐秘地讨论自杀的对立面,即自我保存。在《自杀论》的中译本中,这一隐秘线索的许多证据都被清除,导致书中""自我保存""这一线索在中文学界没有受到重视。本文尝试通过文本分析的方法来理解涂尔干的这一线索。他将不同类型的自杀视为不同道德的极端表达,在具体分析中常常采用一体两面的视角去讨论行动者在何种道德状态下才可能实现""自我保存""。本文试图通过比较说明,涂尔干对这三种自杀类型的界定,以及通过这一界定所呼吁的道德状态,与他对社会学的界定有内在实质的关联。在这个意义上,对于涂尔干来说,社会学本身即是某种现代道德人格的表达,而这种道德人格对于现代性个体与社会学这门学科来说,都具有自我保存的效力。","2018","38","06","https://link.cnki.net/doi/10.15992/j.cnki.31-1123/c.2018.06.003"
"sh260","期刊","齐美尔论个性","王利平; 陈嘉涛","香港大学社会学系;","社会","齐美尔;;尼采;;个性;;生命哲学","本文着重考察齐美尔个性观在其生命哲学中的展开。以个性观在德国思想史中的演变为线索,追溯了自文艺复兴经十八世纪启蒙时代,再到十九世纪浪漫主义兴起之后的一系列重要变化,集中讨论了尼采——作为生命哲学的最初阐发者——的贵族理论是如何影响齐美尔的。尼采笔下备受推崇的个体,在与世界整体相剥离之后,失去作为类存在的归宿感,这也是齐美尔探讨现代个性如何持存的起点。齐美尔在现代资本主义劳动分工、艺术创作之形式的转变以及个体生命时间的展开(尤其是死亡的意义)等不同的层次上,对以生命为立足点寻求个体自我的统一作了深入论述。文章最后回应了韦伯和卢卡奇对齐美尔的批评,笔者认为两者分别从理性主义和马克思的历史唯物主义传统反思了齐美尔的生命哲学。","2018","38","06","https://link.cnki.net/doi/10.15992/j.cnki.31-1123/c.2018.06.002"
"sh261","期刊","家长教养方式的阶层差异及其对子女非认知能力的影响","黄超","南京大学社会学院;","社会","教养方式;;社会经济地位;;非认知能力;;青少年发展","本研究通过""中国教育追踪调查""(CEPS)2014—2015学年追踪数据,考察了当前中国青少年家长教养方式的分布、阶层差异及其对青少年非认知能力的影响。研究发现:首先,当前中国家长的教养方式以专制型和忽视型为主,权威型和宽容型教养方式的比例较低;其次,社会经济地位较高的家庭倾向于选择权威型和宽容型教养方式,社会经济地位较低的家庭倾向于选择专制型或忽视型教养方式;最后,教养方式对非认知能力的发展有显著影响。总体而言,权威型教养方式最有利于培养子女的非认知能力,忽视型教养方式最不利于培养子女的非认知能力。在涉及人际交往的非认知能力指标中,权威型和宽容型教养方式相对于其他两种教养方式具有明显的优势。","2018","38","06","https://link.cnki.net/doi/10.15992/j.cnki.31-1123/c.2018.06.006"
"sh262","期刊","自然灾害与政治信任:基于汶川大地震的自然实验设计","游宇; 黄一凡; 庄玉乙","重庆大学公共管理学院;香港中文大学政治与行政学系;厦门大学公共事务学院;","社会","自然灾害;;政治信任;;汶川地震;;政治传播","在当代中国,自然灾害如何在短期内影响公众的政治信任,其作用机制如何?本文使用在汶川大地震发生前后收集的调查数据,试图通过自然实验设计来回答上述问题。本研究发现:在时间维度上,外生的自然灾害会在短时间内提升公众的政治信任;在结构上,地震对公众政治信任的边际增长效应呈现差序性特征,即对区县政府政治信任的正向作用最强,而对中央政府政治信任的强化作用最弱。在此过程中,国家主导的媒体宣传起到了关键的中介作用,即公众接收官方媒体信息的频率越高,其政治信任在短时间内提升的幅度越大。研究表明,灾后短期内的政府动员与鼓舞性的媒体议程设置是提升公众政治信任的重要影响因素,但从长远来看,切实加强政府的长效治理能力建设始终是巩固政治合法性的关键。","2018","38","05","https://link.cnki.net/doi/10.15992/j.cnki.31-1123/c.2018.05.006"
"sh263","期刊","如何在社会调查中更好地测量中国人的宗教信仰?","张春泥; 卢云峰","北京大学社会学系;","社会","社会调查;;宗教信仰;;宗教性测量;;中国家庭追踪调查","由于西方社会排他性强的聚会性宗教占主导地位,而中国排他性弱的混合宗教更为兴盛,故中国的社会调查运用宗派本位的西方宗教测量工具会遇到遗漏或错分信仰群体等问题。对此,本文从信仰归属、宗教实践、宗教组织成员资格三个维度及这三个维度之间的逻辑关系上提出中西宗教之差别对问卷调查的影响。通过在2014年中国家庭追踪调查中尝试神灵本位的信仰测量方案,以及将其分别与该调查前后两轮追踪调查的问卷设计和数据相比较,本文检验及展现了既有测量工具在采集中国人宗教信仰数据时存在的问题,并提出改进宗教信仰社会测量的建议。","2018","38","05","https://link.cnki.net/doi/10.15992/j.cnki.31-1123/c.2018.05.005"
"sh264","期刊","清代石仓阙氏的科举参与和文武之道","蒋勤","上海交通大学人文学院历史系;","社会","石仓;;科举参与;;武科举","学轨制是教育不平等的重要来源。清代科举考生们同样面临学轨的选择:除了正途考试和异途捐纳外,还有文科举和武科举之分。前人研究多关注文科举中的乡试和会试,鲜有人研究学轨选择的起点——童生试者。本文利用浙南石仓的科举账簿,考察清代中后期阙氏的科举参与。通过炼铁积累财富后,阙氏先是捐纳监生,后逐步参与科举。太平天国战争后,人口减少、武科举中式率提高,阙氏实现了""文武并举""。通过进一步比较""保身家""与""向上流动""这两类科举动机的表现及其结果,本文发现,向上流动的期望可能是个陷阱。因此,基层民众参与科举最终给人以""保身家""为主的印象,是民众自我调适的结果。","2018","38","05","https://link.cnki.net/doi/10.15992/j.cnki.31-1123/c.2018.05.004"
"sh265","期刊","政党、政治与政策:论共产党早期革命中“富农问题”的多重逻辑","孟庆延","中国政法大学社会学院;中国政法大学历史社会学与中共党史研究中心;","社会","富农;;乡村社会;;革命;;地方精英","""富农""是中国共产党在早期革命实践中以阶级进路分析传统乡村社会的重要概念,也是土地革命历史进程中政策争论与变动的焦点所在,同时更是作为革命政党的中国共产党以马列主义意识形态应对近代以来中国乡村社会危机的关键枢纽。本文认为,富农概念在具体的革命场景中具有下述意涵:其一,它经历了从理论概念到革命实践中斗争对象的转化;其二,它在复杂的斗争形势下演变成""富农路线""问题;其三,以""富农""等概念为基础的分田策略又是苏区土地革命中的重要政策问题。上述维度共同形塑了革命的动力机制。本文在详细梳理多种类型史料的基础上,呈现这一转变的复杂历史过程,进而阐释""富农问题""作为革命动力机制的内在逻辑与社会过程。","2018","38","05","https://link.cnki.net/doi/10.15992/j.cnki.31-1123/c.2018.05.003"
"sh267","期刊","现代生命的“社会化”图景","吉砚茹","北京大学社会学系;","社会","形式社会学;;冲突;;生命直观;;现代个体","齐美尔在与康德的对话中提出""社会何以可能""的问题,将社会学确立为对社会化形式的研究,探究现代个体如何与周遭世界产生联系并由此构建自我。齐美尔通过对比古今社会化形式,进而得出对现代生命内在困境的基本洞察。面对现代世界的外在化和碎片化的生活感受,他并未完全采取康德的思路——用认知的方式构建统一的世界来解决主客体冲突,而是参照歌德的生命观,提出一种介于康德与歌德之间的生命学说,使个体能从自身生命的根基生长出与世界的深刻关联,在生命直观之中达成自我与外在世界的和解。","2018","38","05","https://link.cnki.net/doi/10.15992/j.cnki.31-1123/c.2018.05.002"
"sh268","期刊","收入如何影响中国夫妻的家务劳动分工?","孙晓冬","西安交通大学人文社会科学学院,实证社会科学研究所;","社会","收入家务;;劳动经济;;交换性别;;偏离中和;;经济自主","在市场劳动领域的性别隔离程度快速下降的时代,是什么因素使得传统主义的家务劳动性别分工模式得以延续?既往研究将原因指向性别差异依旧明显的个人收入,但学界在收入对家务劳动分工的作用机制与作用方向上存在明显争议。通过对CGSS2012数据的考察发现:妻子对配偶经济依赖的下降会减少其家务劳动比例,二者关系不受个人及配偶绝对收入的影响;配偶绝对收入的加入使得经济依赖与丈夫家务劳动比例的联系从线性负相关关系转变为倒""U""型曲线关系。上述发现对于理解当代中国社会收入与劳动性别分工的关系提供了更为准确与具体的证据,并预示了一种不同于已有理论与经验研究的联系性机制与行动策略。","2018","38","05","https://link.cnki.net/doi/10.15992/j.cnki.31-1123/c.2018.05.008"
"sh269","期刊","大学生毕业意向的影响机制及变迁趋势 基于十年历时调查数据的实证考察","闵尊涛; 陈云松; 王修晓","南京大学社会学系;南京大学—约翰斯·霍普金斯大学中美文化研究中心;中央财经大学社会学系;","社会","家庭背景;;学业表现;;宏观变量;;毕业意向;;教育再生产","通过分析十年历时调查数据,本文探讨了大学生毕业意向的影响因素和时代变迁规律。研究表明,学业表现、家庭背景和宏观环境对大学生升学意愿均有显著影响,个体学业表现的作用最为微弱,家庭背景的优势主要体现在国外留学选择上,在毕业规划方面宏观环境起着重要作用。通过交互分析发现,家庭背景对选择深造,尤其是留学的作用会随着学业表现提高而增强;十年中,家庭背景主导作用和学业表现微弱作用均保持相对稳定。宏观层次的研究生教育自费政策对当年大学生深造意向有显著负向影响,而高校毕业生增长趋势对个体深造意向有显著正向作用。本文证实了""大学教育后""教育机会分配仍然体现的是一种社会再生产逻辑,中国过去十年高等教育领域的转型背景对个体的毕业规划也产生了重要影响。本文有助于完整理解十年来大学生毕业意向的变化轨迹和规律,以及接受高等教育后的教育分层。","2018","38","05","https://link.cnki.net/doi/10.15992/j.cnki.31-1123/c.2018.05.007"
"sh270","期刊","货币之桥上的迷失者 齐美尔论货币与现代性体验","李凌静","中国社会科学杂志社;","社会","齐美尔;;货币;;现代性体验;;厌腻;;文化形式","对现代个体生存体验的关注是齐美尔现代性思考的重要特征。随着货币经济在现代社会的日益繁荣,货币逐渐将其自身的品格渗透到现代人的心理层面,影响现代个体行为,塑造独特的现代性体验。可以说,货币成为""货币""的过程,就是现代人获得其现代体验的过程。都市体验是最为典型的现代性体验,都市人是""忧郁的栖居者"",厌腻态度构成了现代人""忧郁""的内核。而在冒险体验与陌生体验中,蕴藏着现代个体保持独特个性、对抗货币逻辑的可能。通过""货币"",齐美尔试图揭示的不仅仅是现代人的生存问题,更是关乎人类终极价值的问题——在看似碎片化的现代性体验与人类的总体存在方式之间,齐美尔提供了一条经由""货币""的解释路径。","2018","38","05","https://link.cnki.net/doi/10.15992/j.cnki.31-1123/c.2018.05.001"
"sh271","期刊","环境风险感知的影响因素和作用机理 基于核风险感知的混合方法分析","王刚; 宋锴业","中国海洋大学法政学院公共管理系;中国海洋大学海洋发展研究院;中山大学政治与公共事务管理学院公共管理学系;","社会","环境风险;;风险感知;;作用机理;;混合方法","在质性研究和已有文献基础上,本文提出了影响公众环境风险感知的""双因素假说"",并对这一假说进行验证。通过""扎根理论""发现了影响公众环境风险感知的四个维度:环境亲和感、系统信任感、信息丰富性和利益趋向性。前两种属于情感因素,后两者属于情境因素。通过结构方程模型进一步证实,情感、情境因素都对公众环境风险感知具有显著影响。同时发现了信息丰富性与环境风险感知的倒""U""型关系,利益趋向性对公众的环境风险感知具有决定性影响等结果。","2018","38","04","https://link.cnki.net/doi/10.15992/j.cnki.31-1123/c.2018.04.007"
"sh272","期刊","“佛王”与皇帝:清初以来滇缅边疆银矿业的兴衰与山区社会的族群动员","马健雄","香港科技大学人文学部;","社会","佛王;;清缅战争;;银矿;;滇缅边疆;;土司制度","在滇缅交界山区,随着清初大型银矿的开发,地方土司受到来自清朝和缅甸两方国家力量的掣肘。新兴宗教的宗师铜金和尚利用矿工秘密社会、矿区商路和私盐市场之间的交错关系,在官府和土司之间寻求政治发展空间。嘉庆皇帝为了清理清缅战争后的残局,直接主导了对铜金和尚的剿抚决策。通过检视铜金成为地方官员的合伙人、皇帝眼中的政治投机者以及山区民众心目中的""佛王""的过程,本文集中讨论新兴制度创立者社会动员力的发展与国家体制的关系,以及清朝国家力量在边疆的伸缩与山区""佛王""体制及倮黑(拉祜)族群身份建构之间的关联。","2018","38","04","https://link.cnki.net/doi/10.15992/j.cnki.31-1123/c.2018.04.002"
"sh273","期刊","以可行能力视角看待障碍:对现有残障模式的反思与探索","于莲","苏州大学马克思主义学院;","社会","社会模式;;普同模式;;可行能力;;障碍","残障研究经历了个人模式—医学模式—社会模式的发展历程,社会模式对残障产生的原因进行了革命性的解释,大大推进了残障人士权益的发展。但上述模式都将关注点放在障碍产生的原因上,而这可能会强化原因与作为影响的障碍之间的固定联系,进而加重刻板印象以及弱势地位等问题;此外,以原因区分障碍的做法并不能准确地反映人们在现实中遭遇的障碍,在认识、分析和处理障碍方面也存在一些困难和缺陷。因此,我们应当尝试将关注点从障碍产生的原因转向障碍本身,以可行能力受限或者受损看待障碍,将原因和障碍真正""解绑"",从而超越""医学模式—社会模式""""社会隔离—社会融合""""优势—劣势""这些不合理的二元对立。基于这样的转变,我们可以为消除障碍找到更加精准、更具有整体性且更加有效的办法。","2018","38","04","https://link.cnki.net/doi/10.15992/j.cnki.31-1123/c.2018.04.005"
