"id","SrcDatabase","Title","Author","Organ","Source","Keyword","Summary","Year","Volume","Period","URL"
"sh791","期刊","脆弱的团结 对台兴工厂连锁骚乱事件的分析","黄岩","华南师范大学公共管理学院;","社会","全球化;;劳工政治;;脆弱的团结","全球化正在改变中国的产业结构和劳资关系,在华南地区兴起的大量代工企业中,数以千万计的外来打工者面临外来资本和本地政府的双重压迫,他们基于生存而进行的抗争是一种脆弱的抗争。本文从微观机理上剖析了抗争发生的原因及骚乱升级的机会结构,指出了抗争走向失败或沉寂的社会根源,并以此回应海内外其他学者的观察。","2010","30","02","https://link.cnki.net/doi/10.15992/j.cnki.31-1123/c.2010.02.010"
"sh792","期刊","“汽车梦”的社会建构 对《南方周末》(1998～2007)汽车广告内容的分析","林晓珊","浙江师范大学法政与公共管理学院社会工作系;","社会","汽车梦;;汽车广告;;认同策略;;内容分析;;社会建构","今日中国,拥有汽车已成为大多数城市家庭幸福生活的一种理想。在""汽车梦""的社会建构过程中,作为一种消费意识形态的汽车广告在其中起了非常大的作用。本文以《南方周末》(1998～2007)为例,对近十年的汽车广告内容进行分析。文章认为,""个体享乐性想象认同""和""社会参照性成功认同""是汽车广告用来建构""汽车梦""的两个重要的""认同策略"",其影响作用远远超过了汽车广告中的""功用策略"",对广告内容分析的结果证明了本文所提出的研究假设。文章最后对""汽车梦""为什么在近十年得到极力建构的社会根源进行了探讨,并对其所带来的潜在的社会后果进行了深刻的反思。","2010","30","02","https://link.cnki.net/doi/10.15992/j.cnki.31-1123/c.2010.02.011"
"sh793","期刊","组织、工作与情感异化 一项对厦门保险代理人的调查","盛思鑫","澳大利亚新南威尔士大学组织管理系;","社会","保险代理人;;情感矛盾;;处理策略;;情感异化","在借鉴西方保险业营销模式的同时,中国的保险公司对其代理人实行了激进的情感管理。由于较为普遍的社会抵制,保险代理人经常体验到负面情感。而在工作中,对人际关系过度的商业化使用,不仅破坏了代理人原有正常的社会网络,还妨碍了代理人在生活中与他人建立非商业性的关系。""保险生活化,生活保险化""的工作意识形态更是模糊了工作与生活的界限,使保险代理人的工作不可避免地陷入深刻的情感矛盾和冲突之中。尽管代理人通过一系列的策略试图消解这些矛盾与冲突,但是任何的努力都可能加深个体的非人化问题,最终带来情感异化的后果。","2010","30","02","https://link.cnki.net/doi/10.15992/j.cnki.31-1123/c.2010.02.012"
"sh794","期刊","选举动员的框架整合 银杏居委会换届选举个案研究","刘春荣","复旦大学大学政治学;","社会","选举动员;;框架整合;;居委会","社会运动和集体行动研究的""文化和建构主义转向""凸显了框架整合作为微观动员机制的重要性。但是现有文献很少把这一过程置于自上而下的集体行动领域中来考察,同时框架分析在中观层面上的动力机制的认识上尚待深化。本文通过上海市社区居委会选举的个案考察,探索了选举动员中的框架形成和整合过程。研究发现,选举委员会及其所联系的积极分子网络,形成了一个包容性的动员结构。这一特定的动员结构在各个动员环节中,策略性地把国家的政策话语和居民对选举的不同感受衔接起来,整合了民主权利、邻里怀旧和社区认同等阐释框架,由此激发了更大尺度的共鸣和参与。这表明,框架整合与动员的社会结构密不可分,框架化过程实际上建立在特定的社会关系网络的基础之上。","2010","30","01","https://link.cnki.net/doi/10.15992/j.cnki.31-1123/c.2010.01.002"
"sh795","期刊","“工具性”色彩的淡化:一种新健康观的生成与实践 以绍兴醴村为例","姚泽麟","香港大学社会学系;","社会","健康观;;现代化;;国家;;“制造”健康;;“恢复”健康","国内学术界目前还鲜有以医学社会学作为理论视角来探讨当下的医疗、疾病与健康问题。本文基于长三角一个村庄的调查材料,试图从医学社会学角度来讨论当地村民从新中国成立前至今""健康观""的变迁过程。通过新旧健康观的描述与对比,文章主要考察了新健康观变化的内容与动力。村民日益赋予健康以一种崇高的价值,健康观中原有的""工具性""色彩正逐渐淡化。由现代化过程所带来的经济发展与生活水平的提高是新健康观生成的最大动力,而国家在其中的直接作用则非常微小。本文认为,健康观是观察现代化的一个角度,也是考察国家与农民关系的一个新窗口。","2010","30","01","https://link.cnki.net/doi/10.15992/j.cnki.31-1123/c.2010.01.001"
"sh796","期刊","城市移民的政治参与:一个社会网络的分析视角","孙秀林","上海大学中国社会转型与社会组织研究中心,上海大学社会学系;","社会","城市移民;;政治参与;;社会网络","在中国,随着城市化进程的加快,大量来自乡村的移民进入城市,城市移民群体在城市社区中的社会融合与公共事务参与,对于中国未来的城市发展与社会整合具有重要的意义。使用上海地区""2009年社会网络与职业经历问卷调查"",本文采用一个社会网络的分析视角,实证地验证了社会网络对于城市移民政治参与的效果。结果显示:""拜年网""的规模对于城市居民(包括上海户籍与非上海户籍)的政治参与具有负向的效果;""讨论网""的规模只对城市移民群体(非上海户籍居民)具有正向的促进作用;而""社会参与网""表现出了非常显著的正向作用,而且,城市移民群体的""社会参与网""比上海户籍居民具有更强的正向效果。","2010","30","01","https://link.cnki.net/doi/10.15992/j.cnki.31-1123/c.2010.01.003"
"sh797","期刊","乡-城移民社会融入的实践策略研究 社区融入的视角","刘建娥","云南大学社会工作与社会学系;","社会","乡-城移民(农民工);;实践策略;;社区融入;;社会融入","本研究基于社区融入的视角,探讨中国乡-城移民的社会融入的实践策略与理论模式。作者梳理出移民的社区融入的组织化、专业化、政策行动和文化融入这四项实践策略,以使各社区能及时回应移民普遍性需求,提供制度支持,改善政策环境,营造融入文化。作者还提出了在社区实务研究的基础上,发展移民的社会全面融入的理论模式的重要性,即从跨社区融入的广度视角与决策融入的深度视角,推动乡-城移民的社会资本由农村向城市的转移与发展,实现全面的社会融入。","2010","30","01","https://link.cnki.net/doi/10.15992/j.cnki.31-1123/c.2010.01.004"
"sh799","期刊","组织社会学研究的深入与拓展 2009年(第六届)“组织社会学实证研究工作坊”综述","狄金华","华中科技大学社会学系;","社会",NA,NA,"2010","30","01","https://link.cnki.net/doi/10.15992/j.cnki.31-1123/c.2010.01.005"
"sh800","期刊","属下能说话吗 “诉苦文类”的民族志批评","马丹丹","上海大学人类学研究所;","社会","属下;;僭越;;诉苦","本文回顾了""诉苦""的中国经验,以诉苦文类涵盖丰富的诉苦文本,意不在诉苦本身,而是透过诉苦的权力谱系开展民族志批评,指出诉苦权力塑造的主体性包含的被占有支配能量,吸附了庶民研究者与主体欲望同构的缓冲地带。尽管如此,由于民族志批评者的寄生性,诉苦谱系的节点拆解了封闭的现代性寓言,苦痛的延展使得属下呈现出差异性、延迟性的庶民性裂痕,从而揭示知识分子""中介化""的困境。","2010","30","01","https://link.cnki.net/doi/10.15992/j.cnki.31-1123/c.2010.01.006"
"sh801","期刊","“凤凰男”能飞多高 中国农转非男性的晋升之路","林易","北京大学社会学系;","社会","户籍制度;;地位等级;;社会流动","本文利用全国综合社会调查数据,以地位等级和地位类别概念来分析男性农转非人口的代内流动。研究发现,他们通常有不错的工作,也更容易获得晋升,但他们在从中级晋升到高级时却处于劣势。此外,除了在专业职称晋升上拥有优势之外,他们很难在行政上获得晋升,也难以在体制外获得高级管理职位。本文认为,社会资本缺乏是造成这种现象的可能原因之一。","2010","30","01","https://link.cnki.net/doi/10.15992/j.cnki.31-1123/c.2010.01.007"
"sh802","期刊","退“公”进“私”:政府渗透商会的一个分析","刘世定","北京大学中国社会与发展研究中心;上海高校社会学E-研究院;","社会","企业主;;商会;;产权;;乡镇政府","本文分析了苏南一个乡镇中四家商会的组织和运行状况。特别关注乡镇政府一方面在集体企业产权结构变革中退出对企业资产的控制,另一方面又积极渗透进私有企业主商会组织的行为。本文描述了政府渗透下商会组织的特征,讨论了政府何以需要商会、企业主利用商会做什么、政府何以要渗透商会,以及企业主何以接受政府的渗透等问题。从中可透视国家政治制度在私有产权的控制和运用中的作用。","2010","30","01","https://link.cnki.net/doi/10.15992/j.cnki.31-1123/c.2010.01.008"
"sh803","期刊","中国劳动力市场人力资本对社会经济地位的影响","李培林; 田丰","中国社会科学院社会学研究所;上海大学社会学E-研究院;","社会","人力资本;;劳动力市场;;社会经济地位;;中国","本文试图解释为什么在中国教育收益率不断提高的情况下,收入差距出现不断扩大的趋势。根据中国社会科学院社会学研究所在2008年进行的""中国社会状况综合调查""的数据,本文分析了以教育年份、技术水平和工作经验为表征的人力资本因素对劳动力市场上人们的经济社会地位的影响,这种经济社会地位是以收入水平和社会保障状况来界定的。根据对调查数据的分析,本文发现,不同的社会阶层,教育收益率是有很大差异的,但这种差异主要是受人力资本因素的影响,而社会保障状况的差异则主要是受户籍等制度因素的影响。本文由此引申出的结论是,中国劳动力市场具有二元分割的特征,这种特征决定了劳动力市场上的社会分层机制。","2010","30","01","https://link.cnki.net/doi/10.15992/j.cnki.31-1123/c.2010.01.010"
"sh804","期刊","人力资本、劳动力市场分割与收入分配","王甫勤","复旦大学社会学系;","社会","人力资本;;劳动力市场分割;;收入分配;;社会公平","关于收入不平等的解释,学界有个人主义和结构主义两种理论取向。笔者整合两种理论解释,同时考虑人力资本和劳动力市场结构,以及两者之间的交互效应,提出一个影响收入分配的基本模型。用""中国综合社会调查""(CGSS2003)数据对这一模型的检验表明,人力资本是决定收入分配的主要因素,但市场部门对劳动力的分割所产生的影响也不可忽视;人力资本和市场部门之间存在交互作用,人力资本越多的劳动力越容易进入国有部门(垄断或非垄断);同时,国有部门(垄断或非垄断)也能为内部劳动力提供更多提升人力资本的机会。","2010","30","01","https://link.cnki.net/doi/10.15992/j.cnki.31-1123/c.2010.01.011"
"sh805","期刊","在资源与制度之间:农民工草根NGO的生存策略以珠三角农民工维权NGO为例","和经纬; 黄培茹; 黄慧","新加坡国立大学李光耀公共政策学院;厦门大学公共事务学院;伊利诺伊大学香槟校区社会工作学院;","社会","草根组织;;NGO;;策略;;农民工;;维权;;珠三角","观察中国民间社会的发展,对草根组织的研究必不可少。近十年来,珠江三角洲严峻的劳权状况和政府、工会的缺位,催生出一批草根性农民工维权NGO。在中国民间非政府组织整体生存环境不佳的大背景下,由于涉及""劳权""、""人权""等的敏感议题,农民工维权NGO的发展举步维艰。面对制度和资源的双重制约,草根NGO为了生存,采取了一系列策略。它们的生存状况与所持的政治意识形态和维权理念密切相关;为了补充合法性资源,草根组织不得不着眼于制度外的道义正当性,以期获得社会的支持以及政府的默认;草根组织试图通过建立顾问委员会、理事会等方式获得知识精英的背书,有的还诉诸与政府官员的个人联系。新近出现的自体制内组建的NGO为研究珠三角农民工维权NGO提供了新素材。","2009","29","06","https://link.cnki.net/doi/10.15992/j.cnki.31-1123/c.2009.06.001"
"sh806","期刊","转型时期居委会的社区权力及声望研究","闵学勤","南京大学社会学院社会学系;","社会","居民委员会;;社区权力;;社区声望","在中国城市社会变迁的转型时期,社区居民委员会的权力与声望正在经受前所未有的挑战。对南京BX区61个社区居民的随机抽样调查及分析表明:居委会目前的社区权力结构中仍以政府赋予的行政权为主,而在社区居民对其期待颇多的自治权、协管与监督权、突发事件处理权等的运用方面,居委会并未拥有足够的资源存量;社区其他营利及非营利组织在直接参与社区服务和管理的过程中多少瓜分了居委会的权力,从而影响了居委会的声望,并且随着社区居民群体在经济、社会及文化层面的进一步分化,居委会在不同社区成员中的权力与声望呈现差异化的格局。","2009","29","06","https://link.cnki.net/doi/10.15992/j.cnki.31-1123/c.2009.06.002"
"sh807","期刊","代际流动的模式:理论理想型与中国现实","李煜","上海高校社会学E-研究院;上海社会科学院社会学研究所;","社会","代际流动;;理想类型;;流动模式","本文在疏理西方代际流动理论的基础上,提出流动模式的三种理想类型,并分析其制度条件和结构特征,希望能对当代中国社会流动的特征和趋势分析有所启发。本文认为,在不同的制度背景和社会条件下,相应的流动模式是不同的。本文提出三种理想类型对应于三种不同的社会类型,分别是(1)依据绩效原则的自由竞争模式,其特征是流动机会按个人能力和贡献分配,对应于完全市场制度的社会;(2)社会不平等结构下的家庭地位继承模式,其特征是家庭的社会经济背景对子女的地位获得有决定性的影响,社会的不平等结构因此而代代相传,如果一个社会的不平等程度越大,跨阶层流动越困难,代际的地位继承性特征越突出;(3)国家庇护流动模式,其特征是国家通过政策和制度设计,干预社会流动进程,特定的阶层将拥有更多的流动机会、或被剥夺应有的机会。文章最后对中国改革开放后流动模式的转变和现状提出了一些基本的判断。","2009","29","06","https://link.cnki.net/doi/10.15992/j.cnki.31-1123/c.2009.06.005"
"sh808","期刊","贿赂中的自我道德化与嵌入性腐败基于H市纪检监察机关档案的一项文本研究","李辉","复旦大学国际关系与公共事务学院;复旦大学基层社会与国家建设研究中心;","社会","贿赂;;礼物;;自我道德化;;嵌入性腐败","本文主要依据H市纪检监察部门的案件询问与谈话笔录文本,力图使用国家-个体关系理论模型,考察贿赂行动的实践过程。通过相关文本,笔者发现,以往将贿赂行为描述为一种不道德的交易行为,并不能准确揭示贿赂行为的本质;相反,贿赂行动中的行动者在实践过程中通过种种符号与象征行为,有将贿赂交易""自我道德化""的强烈倾向。而就经济学角度将贿赂行动描述为权力与金钱相交换的市场行为而言,也有将贿赂行为简单化的倾向,其与纯粹的市场交易行为本身有着本质区别。有鉴于此,笔者倾向于将贿赂界定为一种通过行动者的自我道德化表演,而嵌入在传统的礼物赠与行为与现代市场交易行为之间的特殊社会交换形态。","2009","29","06","https://link.cnki.net/doi/10.15992/j.cnki.31-1123/c.2009.06.006"
"sh809","期刊","精英型与草根型框架借用比较失地农民与知识精英的集体抗争","黎相宜","中山大学社会学与社会工作系;","社会","框架借用;;草根型框架借用;;精英型框架借用;;失地农民;;知识精英;;置换","本文利用""框架借用""的概念,对处于同一集体抗争""主框架""下的失地农民与知识精英两个不同性质群体的集体抗争进行了比较研究,指出失地农民通过借用知识精英的话语及策略以建构自己的运动框架,形成草根型框架借用;同时,知识精英也利用失地农民叙事框架的""弱势""特征,形成精英型框架借用,而二者之间的非对称性,很可能导致精英将草根的利益诉求进行""失真处理"",使草根的部分利益诉求被""置换""。","2009","29","06","https://link.cnki.net/doi/10.15992/j.cnki.31-1123/c.2009.06.007"
"sh810","期刊","农民“种房”的行动理性对W市S村的个案研究","王三意; 雷洪","中山大学社会学系;华中科技大学社会学系;","社会","农民;;种房;;行动理性","本研究考察郊区城市化过程中的""种房风""现象,选取了W市近郊一个行政村为个案进行田野调查,主要以访谈法、辅之以观察法和文献法来收集资料,从""种房""现象主体主观的角度,考察农民""种房""成风的原因。研究发现:农民种房是非现实需要的行动选择;选择种房主要是基于超额补偿效用,也有经营和增加收入效用、心理平衡效用、情感归属效用;而农民种房行动理性的诱因是种种政府因素,这是种房现象成风的根本内在原因。本研究的结论认为:更深层关注和研究的问题是政府如何调整自身的行为。","2009","29","06","https://link.cnki.net/doi/10.15992/j.cnki.31-1123/c.2009.06.008"
"sh811","期刊","劳动合作、仪礼交换与社会结群广西龙脊壮族村落的社群结构分析","郭立新","中山大学历史人类学研究中心;中山大学社会学与人类学学院;","社会","壮族;;村落;;社会建构;;劳动合作;;仪礼交换","本文通过对广西龙脊壮族家族和村寨组织的构成及其运作进行描述与分析,具体地呈现一个壮族地方社会的建构逻辑。文章认为,龙脊壮人的""家门""是一个依两可家系组织起来的血缘组织,以家屋为核心,且与家屋具有同构性;""寨""则是一个血缘与地缘合二为一,以寨老为联系中心的人群共同体。""家门""与""寨""以劳动合作和互助以及仪礼交换为基础进行建构;他们充当着家屋之间社群联结及友情的蓄水池,承载并具体实践着龙脊壮人与自己人一起劳动、一起吃住,跟自己人结婚的理想。","2009","29","06","https://link.cnki.net/doi/10.15992/j.cnki.31-1123/c.2009.06.009"
"sh812","期刊","从制度性底层到结构性底层由威尔逊《真正的穷人》思考中国底层群体管理问题","贾玉娇","吉林大学哲学社会学院;","社会","制度性底层;;结构性底层;;底层管理机制","美国在急剧的社会转型过程中,形成了以往的社会分层概念体系所不能准确把握的一类群体,即底层群体,他们的本质特征在于与主流社会的就业体系和行为规范体系相断裂。威尔逊敏锐地把握住了这一特征,将聚居区底层群体的形成归因为经济社会体系的结构性转型,颠覆了制度性底层的传统观点,并提出通过形成政治联盟,制定普遍性政策,运用隐秘议程的政治策略建构对底层群体有效的管理机制。本文在借鉴威尔逊理论分析的基础上,结合孙立平的""断裂""论,探析中国底层管理问题。","2009","29","06","https://link.cnki.net/doi/10.15992/j.cnki.31-1123/c.2009.06.010"
"sh813","期刊","十年来中国抗争运动研究评述","李德满","江西财经大学马克思主义学院;","社会","抗争运动;;机制分析;;比较研究","上世纪90年代以来,中国的抗争运动爆发的频度和影响力不断增长,吸引了越来越多研究者的关注,海内外关于这一题域的研究也日渐兴起。这一研究题域在概念谱系上呈现出多元化的状态,以过程分析、结构分析和机制分析作为其主要的分析路径,以集体行动、日常抵抗、社会动员以及政治过程等理论为指导,并特别关注抗争运动与民主政治的关系;在研究方法上,规范性实证研究的比例正在上升,定量研究和比较研究是未来的发展方向。","2009","29","06","https://link.cnki.net/doi/10.15992/j.cnki.31-1123/c.2009.06.011"
"sh814","期刊","《社会学年鉴》(2007)概述","梁茂春","暨南大学行政管理学院;","社会",NA,NA,"2009","29","06","https://link.cnki.net/doi/10.15992/j.cnki.31-1123/c.2009.06.012"
"sh815","期刊","“自主选择”还是“身不由己”对南京企业员工职业流动的事件史分析","龙书芹","东南大学人文学院社会学系;","社会","职业流动;;事件史分析;;时变性变量","本文以666份对南京企业员工调查的数据为基础,运用事件史分析方法,分析了社会转型过程中企业员工的职业流动问题,揭示了影响其职业流动的影响因素,以及他们在以单位所有制性质为区分的劳动力市场格局中的流动趋向。研究结果表明,社会转型所带来的机会结构的转变是企业员工职业流动的主要推动力量,而伴随着社会转型而改变的劳动力市场分割,则为他们的职业流动制定了游戏规则,个体的家庭背景和个人因素仅仅是这些游戏规则之下的筹码。因此,中国社会转型过程中,企业员工的职业流动是由社会结构决定的、非常有限的""自主选择"",换言之,这是一种身不由己的""自由选择""。","2009","29","06","https://link.cnki.net/doi/10.15992/j.cnki.31-1123/c.2009.06.013"
"sh816","期刊","阶层背景对本科毕业生职业地位获得的影响 市场转型与分割的阶层再生产","李黎明; 李卫东","西安交通大学人文社会科学学院社会学系;","社会","市场转型;;阶层再生产;;二元分割性;;市场能力","本研究利用2007年""阶层背景和本科毕业生职业地位""的抽样调查数据,通过分析阶层背景对本科毕业生职业地位获得的影响,探讨了市场转型期间的阶层相对关系模式,发现在市场转型过程中,政治与市场的同进化过程同样是新旧利益群体竞争性的分化与共享,以及对体力劳动者阶层子代本科毕业生排斥的过程,政治与市场的汇流使得优势阶层被垄断性继承,从而使代际继承呈现二元分割性。","2009","29","05","https://link.cnki.net/doi/10.15992/j.cnki.31-1123/c.2009.05.001"
"sh817","期刊","老人的居住模式与子女的赡养行为","谢桂华","中国人民大学社会学系;","社会","居住模式;;居住距离;;赡养行为;;子女数量","本文使用2006年全国社会综合调查的抽样数据,分析了老年人的居住模式、与子女的居住距离和儿女数量对子女赡养行为的影响。研究发现,老人的居住模式和居住距离并不明显影响子女给予的经济支持,但会影响子女在日常照料和情感慰藉方面给予的支持。有同住子女的父母可以得到子女更频繁的关心和照顾,而空巢家庭的父母从子女处获得的日常照料和经济支持则较少;子女居住得离父母越近,则越经常给予父母日常照料和情感慰藉。研究也发现,子女给予父母各方面照料的频繁程度不受兄弟姐妹数量的影响,独生子女并不比非独生子女更频繁地照顾父母。","2009","29","05","https://link.cnki.net/doi/10.15992/j.cnki.31-1123/c.2009.05.002"
"sh818","期刊","传统儿童照顾模式的失灵与流浪儿童问题的形成 基于对上海火车站地区流浪儿童的民族志调查","程福财","上海社会科学院青少年研究所;","社会","流浪儿童;;流浪原因;;社会转型","流浪儿童现象是一个普世性的问题。本研究通过对上海火车站地区49名流浪儿童的民族志调查发现,流浪儿童问题的生成主要是由社会转型过程的家庭功能失调、从农村到城市的人口流动和儿童对自主童年的追求等因素造成的。这些因素的存在,使得社会文化已确定的规范性儿童照顾模式与儿童的实际生活条件之间产生明显的断裂,进而迫使儿童外出流浪以寻找替代性的生存机会。","2009","29","05","https://link.cnki.net/doi/10.15992/j.cnki.31-1123/c.2009.05.003"
"sh819","期刊","《欧洲社会学评论》2007年刊文概述","赵蕊","北京大学社会学系;","社会",NA,NA,"2009","29","05","https://link.cnki.net/doi/10.15992/j.cnki.31-1123/c.2009.05.004"
